REC_088,Mesa 12 - Medios de implementación,"MI3) A 2030, Chile diseñará y desarrollará una estrategia financiera que, siguiendo las disposiciones de la LMCC, incorpore además los compromisos nacionales en materia de biodiversidad, economía circular y transición socioecológica justa. Esto considera las siguientes acciones:"
REC_089,Mesa 12 - Medios de implementación,"a) A 2026, Chile contará con un listado de proyectos de inversión climática asociado al cumplimiento de los Instrumentos de Gestión del Cambio Climático (IGCC) reportados en el programa país nacional ante el FVC."
REC_090,Mesa 12 - Medios de implementación,"b) A 2030, Chile contará con un corredor de financiamiento climático, como mecanismo que permita articular la aceleración y canalización tanto del financiamiento climático como de los procesos de innovación, el desarrollo de capacidades y la transferencia tecnológica de iniciativas climáticas."
REC_091,Mesa 12 - Medios de implementación,"c) A 2030, Chile contará con un repositorio digital abierto para disponer de información de sostenibilidad relevante y proyectos existentes en este ámbito, para apoyar la toma de decisiones de inversionistas."
REC_092,Mesa 12 - Medios de implementación,"d) A 2030, Chile habrá incorporado el análisis del gasto público e inversión climática a proyectos vinculados con la implementación de los compromisos climáticos de los distintos IGCC. Se contará con instancias de revisión y análisis de las mediciones de gasto e inversión climática, para integrarlas a la toma de decisiones en el sector público."
REC_093,Mesa 12 - Medios de implementación,"e) A 2035, Chile incorporará el enfoque de capital natural en la formulación y evaluación de programas y políticas gubernamentales, con especial foco en la implementación de las medidas de los planes sectoriales y regionales."
REC_094,Mesa 12 - Medios de implementación,"f) A 2030, Chile contará con incentivos para el sector privado, y mantendrá instancias de coordinación que apoyen y faciliten el cumplimiento de las normas de divulgación de información en materia de cambio climático y sostenibilidad, incluyendo Pymes."
REC_095,Mesa 13 - Subnacional,"SN1) A 2026, se habrán fortalecido las capacidades y la institucionalidad de cambio climático a nivel regional; se habrá finalizado la elaboración de los PARCC; se habrá iniciado la implementación de acciones de adaptación, mitigación y los medios de implementación necesarios, a través de los planes de acción regionales de cambio climático, en las 16 regiones del país."
REC_096,Mesa 13 - Subnacional,"SN2) Desde 2026, todas las regiones del país que actualicen los Planes Regionales de Reducción del Riesgo de Desastres habrán incorporado acciones de adaptación al cambio climático, en comunicación y/o coordinación con los Comités Regionales de Cambio Climático."
REC_097,Mesa 13 - Subnacional,"SN3) Desde 2026, los planes de descontaminación y/o prevención atmosférica deberán contribuir a la reducción de GEI."
REC_098,Mesa 13 - Subnacional,"SN4) A 2026, se habrán elaborado Planes de Acción Comunal de Cambio Climático en todas las comunas del país."
REC_099,Mesa 13 - Subnacional,"SN5) A 2026, Chile contará con una red de articulación de financiamiento climático subnacional activa y con planes de acción macrozonales, a través del Grupo de Acción para el Financiamiento Climático Comunal y Regional."
REC_100,Mesa 13 - Subnacional,"SN6) A 2030, se habrán elaborado Planes Estratégicos de Cuenca para Gestión de Recursos Hídricos en 101 cuencas del país."
REC_101,Mesa 13 - Subnacional,"SN7) A 2030, el Ministerio del Medio Ambiente elaborará una herramienta comunal de Huella Chile que proveerá una estimación de los inventarios comunales de gases de efecto invernadero para todos los municipios del país."
REC_102,Mesa 13 - Subnacional,"SN8) Chile fortalecerá la generación de capacidades subnacionales mediante la creación de un programa de formación técnica e institucional para los gobiernos regionales en áreas de cambio climático, gestión de riesgos y financiamiento climático, que contemple acceso a herramientas tecnológicas y metodologías para el desarrollo e implementación de las acciones climáticas."
