ID,Mesa,Compromiso en el anteproyecto
REC_001,Mesa 1 - Transición Socioecologica Justa,PTSEJ1) Implementar la Estrategia Nacional de Transición Socioecológica Justa 2025- 2035.
REC_002,Mesa 1 - Transición Socioecologica Justa,"PTSEJ2) A 2028, Chile contará con una metodología de medición de variables socioeconómicas que permita gestionar, a nivel sectorial, la transición laboral justa de los empleos impactados por el cambio climático."
REC_003,Mesa 1 - Transición Socioecologica Justa,"PTSEJ3) A 2035, cada Plan Sectorial de Mitigación o de Adaptación al Cambio Climático habrá implementado al menos una medida que contribuya a la protección del empleo y/o a la reconversión laboral en actividades productivas vulnerables al cambio climático, o que sean sujetas de medidas de mitigación de GEI."
REC_004,Mesa 1 - Transición Socioecologica Justa,"PTSEJ4) A 2029, los informes de evaluación de los instrumentos de gestión de cambio climático medirán los costos y beneficios económicos, ambientales y sociales de las políticas climáticas, integrando indicadores de salud, empleo, equidad de género y reducción de la pobreza, entre otros. Asimismo, incorporarán información desagregada por grupos vulnerables, de acuerdo con una metodología estandarizada que se pondrá a disposición a más tardar el año 2027."
REC_005,Mesa 1 - Transición Socioecologica Justa,"PTSEJ5) A 2026, los Planes Comunales de Cambio Climático de los territorios en transición definidos en la ETSEJ, incluirán los lineamientos de la ETSEJ."
REC_006,Mesa 1 - Transición Socioecologica Justa,Desarrollo de Capacidades y Pertinencia Territorial en Transición
REC_007,Mesa 2 - Transición Energética,"Contribución M1) 
Chile se compromete a un presupuesto de emisiones de GEI que no superará las 1.100 MtCO2eq entre 2020 y 2030, con un máximo de emisiones (peak) de GEI a 2025, y a alcanzar un nivel de emisiones de GEI de 95 MtCO2eq a 2030-. Adicionalmente, Chile se compromete a un presupuesto nacional de emisiones de GEI que no superará las 490 MtCO2eq, entre 2031 y 2035, y a alcanzar un nivel de emisiones de GEI de 91 MtCO2eq a 2035."
REC_008,Mesa 2 - Transición Energética,"Contribución M2) 
Elaborar, implementar y actualizar 7 planes sectoriales de mitigación (Transporte, Energía, Ciudades, Minería, Infraestructura, Residuos y Agricultura) definidos por la Ley N° 21.455, Marco de Cambio Climático, para garantizar el cumplimiento del presupuesto nacional de emisiones de GEI."
REC_009,Mesa 2 - Transición Energética,"Contribución M3) 
Promover cambios modales hacia transporte bajos en emisiones a nivel marítimo, ferroviario y terrestre."
REC_010,Mesa 2 - Transición Energética,"Contribución M4) 
Ampliar la participación de organizaciones en el sistema de certificación voluntaria de gases de efecto invernadero y uso del agua (Programa Huella Chile), alcanzando, a 2030, al 20% del total de emisiones reportadas en comparación con el total de emisiones del inventario nacional de Chile"
REC_011,Mesa 2 - Transición Energética,"Contribución M5) 
Establecer una meta de eficiencia energética a 2035, equivalente a la meta de la Ley N° 21.305, respecto de la intensidad de eficiencia energética de un año de referencia.








"
REC_012,Mesa 2 - Transición Energética,"Recomendación a nivel general del capítulo.
Tema: Desarrollo Territorial y Financiamiento en la Transición Energética"
REC_013,Mesa 2 - Transición Energética,"Recomendación a nivel general del capítulo.
Tema: Eficiencia energética para la mitigación y el uso racional de la energía"
REC_014,Mesa 3 - Forzantes Climáticos Vida Corta,"Contribución M6) 
Una reducción de al menos un 25% de las emisiones totales de carbono negro a 2030 respecto a los niveles estimados para el sector energía del Inventario Nacional de Emisiones a 2016. El cumplimiento de este compromiso considera las medidas relacionadas a la reducción de emisiones de GEI, y acciones específicas para mejorar los niveles de contaminación del aire"
REC_015,Mesa 3 - Forzantes Climáticos Vida Corta,"Contribución M7) 
Alcanzar un máximo de emisiones (peak) de CH4 a 2025. Adicionalmente, se compromete una reducción de un 10% al 2035 con respecto al máximo."
REC_016,Mesa 3 - Forzantes Climáticos Vida Corta,"Contribución M8) 

Elaborar a 2028 una regulación sobre los gases HFCs de uso nacional en grandes superficies refrigeradas, o en sectores de alto crecimiento y capacidad de transición, como el transporte y la climatización privada."
REC_017,Mesa 3 - Forzantes Climáticos Vida Corta,"Recomendación a nivel general del capítulo.
Tema: Monitoreo y Transparencia en Medidas de Mitigación Climática:"
REC_018,Mesa 3 - Forzantes Climáticos Vida Corta,"Recomendación a nivel general del capítulo.
Tema: Estrategias integradas para la mitigación de emisiones"
REC_019,Mesa 4 - Economía Circular,"Contribución M9) 


Chile se compromete a potenciar la valorización de residuos orgánicos en el país, llegando a un 30% al 2030 mediante la aprobación del proyecto de ley actualmente en trámite."
REC_020,Mesa 4 - Economía Circular,"Contribución M10) 

Reducir la cantidad de residuos generados por pérdida y desperdicio de alimentos."
REC_021,Mesa 4 - Economía Circular,"Recomendación a nivel general del capítulo.

Tema: Monitoreo y Evaluación de Intervenciones en Economía Circular"
REC_022,Mesa 4 - Economía Circular,"Recomendación a nivel general del capítulo.

Integración de residuos industriales y sectoriales en la economía circular"
REC_023,Adaptación,"A1) Evaluación del impacto, del riesgo y de la vulnerabilidad, la planificación, la implementación y el monitoreo, evaluación y aprendizaje. Esto considera los siguientes compromisos:"
REC_024,Adaptación,"Contribución A1 a)
A 2030, se habrá implementado el Plan Nacional de Adaptación al Cambio Climático 2025-2028 (en actualización en 2024 en el marco de la LMCC), dando lineamientos estratégicos para los planes sectoriales de adaptación, y contando con una evaluación y lecciones aprendidas que serán aplicadas para su tercer ciclo de actualización."
REC_025,Adaptación,"Contribución A1 b
A 2030, se habrán implementado los 12 Planes Sectoriales de Adaptación."
REC_026,Adaptación,"Contribución A1 c
A 2030, se habrán evaluado los Planes Sectoriales de Adaptación, y se contará con las lecciones aprendidas que serán aplicadas para la actualización de estos planes."
REC_027,Adaptación,"Contribución A1 d
A 2028, se contará con un inventario nacional de impactos del cambio climático en Chile, que incluirá la evaluación de costos de la inacción y de las pérdidas y daños, y que será parte de la Plataforma de Adaptación Climática (Atlas de Riesgos Climático)."
REC_028,Adaptación,"Contribución A1 e)
A 2031, los planes sectoriales de adaptación actualizados cuentan con estándares y lineamientos transversales sobre grupos vulnerables al cambio climático, la reducción de las brechas de género, la consideración de soluciones basadas en la naturaleza y el enfoque de reducción del riesgo de desastres."
REC_029,Adaptación,"Contribución A1 f)
A 2026, se contará con indicadores de seguimiento y de resultado de los planes sectoriales y del Plan Nacional de Adaptación, y a 2028 se contará con índices de resiliencia climática que establezcan criterios específicos para facilitar la medición transversal en el avance de la adaptación y resiliencia climática."
REC_030,Adaptación,"Contribución A1 g)
A 2025, se implementará y alimentará un registro de acciones de adaptación de actores no gubernamentales, y a 2027 se tendrá una plataforma de experiencias de adaptación de actores no estatales como parte del Sistema Nacional de Acceso a la Información y Participación Ciudadana sobre Cambio Climático."
REC_031,Adaptación,"Contribución A1 j)
A 2030, se habrá completado la implementación de la Política Nacional para la Reducción del Riesgo de Desastres 2019-2030, la que se ha armonizado al Marco de Sendai para la Reducción del Riesgo de Desastres, al Acuerdo de París y a la Agenda 2030 para el Desarrollo Sostenible. A 2035, Chile fortalecerá el monitoreo y los sistemas de alerta temprana de riesgos asociados al cambio climático, y habrá comenzado la implementación de intervenciones para aumentar la resiliencia."
REC_032,Adaptación,"Contribución A1 k)
A 2030, se contará con una evaluación sobre el avance en la implementación de sistemas de alerta temprana de eventos meteorológicos extremos, que considerará a los grupos vulnerables y la movilidad humana."
REC_033,Mesa 5 - Seguridad Hídrica,"A2) Reducir significativamente la escasez hídrica inducida por el cambio climático y mejorar la resiliencia climática ante peligros relacionados con el agua, avanzar hacia un suministro de agua y saneamiento resilientes al clima, y hacia el acceso a agua potable segura y asequible para toda la población. Esto considera los siguientes compromisos:"
REC_034,Mesa 5 - Seguridad Hídrica,"a) A 2026, se habrá implementado un indicador, a nivel nacional y a escala de cuenca hidrográfica, que permita hacer seguimiento de la brecha y riesgo hídrico, y avanzar en alcanzar la seguridad hídrica del país."
REC_035,Mesa 5 - Seguridad Hídrica,"b) A 2026 se habrá implementado un sistema de sellos de reconocimiento según el nivel de gestión del consumo de agua a nivel organizacional, a través del programa Huella Chile."
REC_036,Mesa 5 - Seguridad Hídrica,"c) A 2030 se habrá fiscalizado un 95% de los sistemas sanitarios rurales catastrados, asegurando los estándares de calidad de los servicios de agua potable rural."
REC_037,Mesa 5 - Seguridad Hídrica,"d) A 2030, el 100% de las empresas sanitarias tendrán implementado un plan para la gestión del riesgo de desastres, incluyendo aquellos derivados del cambio climático."
REC_038,Mesa 5 - Seguridad Hídrica,"e) A 2030, se habrán completado el 100% de las metas de la Agenda 2030 del sector sanitario."
REC_039,Mesa 5 - Seguridad Hídrica,"f) A 2030, cada proyecto de infraestructura pública para aguas contemplará, en su evaluación, la condición de proteger a la población y territorio (mediante obras fluviales) y/o atender en forma prioritaria las demandas asociadas al consumo humano urbano y/o rural, en su área de influencia."
REC_040,Mesa 5 - Seguridad Hídrica,"g) A 2030, se reducirán al menos en un 25% las pérdidas de agua por concepto del volumen de aguas no facturadas de los sistemas sanitarios."
REC_041,Mesa 6 - Salud,"A3) A 2030, se aumentará la resiliencia del sector Salud frente a las consecuencias del cambio climático, se promoverá la resiliencia climática de los servicios de salud y se avanzará en reducir significativamente la morbilidad y mortalidad relacionadas con el clima, especialmente en las comunidades más vulnerables. Esto considera los siguientes compromisos:"
REC_042,Mesa 6 - Salud,"a) A 2029, Chile contará con una evaluación de los riesgos climáticos en el sector salud para apoyar la actualización de la Estrategia Nacional de Salud de Chile y la actualización del Plan de Adaptación del sector Salud, entre otras políticas públicas asociadas a salud y cambio climático."
REC_043,Mesa 6 - Salud,"b) A 2030, Chile contará con una plataforma del sistema de vigilancia epidemiológica nacional sobre los efectos en salud asociados al cambio climático, que permita monitorear, analizar y alertar sobre los efectos en la salud relacionados con variaciones meteorologicas, tales com temperaturas extremas, asi como de enfermedades vectoriales, enfermedades transmitidas por el agua y los alimentos, así como otros eventos hidro-meteorológicos extremos, proporcionando información clave para apoyar la toma de decisiones en salud pública."
REC_044,Mesa 6 - Salud,"c) A 2035, Chile habrá evaluado e implementado mejoras a la plataforma del sistema de vigilancia epidemiológica nacional respecto a los efectos en salud asociados al cambio climático."
REC_045,Mesa 6 - Salud,"Vínculos entre Salud Física y Mental, Biodiversidad y Clima
"
REC_046,Mesa 7 - Infraestructura,"A4) A 2035, el 50% de la nueva infraestructura pública habrá considerado el cambio climático y sus proyecciones en la fase de diseño de los proyectos de infraestructura hidráulica, vial y de borde costero, para aumentar la resiliencia de la infraestructura y los asentamientos humanos frente a los efectos del cambio climático."
REC_047,Mesa 7 - Infraestructura,"Recomendación a nivel general del capítulo.

Fortalecimiento de la planificación integrada y coordinación interinstitucional
"
REC_048,Mesa 7 - Infraestructura,"Recomendación a nivel general del capítulo.

Desarrollo de Indicadores para la Adaptación Climática
"
REC_049,Mesa 8 - Seguridad Alimentaria,"Contribución A6) 

A 2035, Chile logrará un avance sustantivo en la producción agrícola y de alimentos de la pesca y acuicultura resilientes al clima, así como en el suministro y la distribución de alimentos, aumentando la producción con prácticas sustentables como la agroecología y la agricultura regenerativa, que permitan el acceso equitativo a alimentos saludables y a la nutrición para toda la población."
REC_050,Mesa 8 - Seguridad Alimentaria,"Recomendación a nivel general del capítulo.

Tema: Desarrollo de un sistema alimentario nacional resiliente frente al Cambio Climático"
REC_051,Mesa 8 - Seguridad Alimentaria,"Recomendación a nivel general del capítulo.

Tema: Indicadores para la Seguridad Alimentaria y Cambio Climático"
REC_052,Biodiversidad,"A 2035 se implementará y acelerará el uso de la adaptación basada en los ecosistemas y de las soluciones basadas en la naturaleza, en particular mediante la gestión, mejora, restauración y conservación de los ecosistemas y la biodiversidad, así como mediante la protección de los ecosistemas terrestres, de aguas interiores, de montaña, marinos y costeros."
REC_053,Mesa 9 - Bosques y Turberas,"Contribución I1) 

Chile se compromete al manejo sustentable y recuperación de 200.000 hectáreas de bosques nativos, representando capturas de GEI de alrededor de 0,9 a 1,2 MtCO2eq anuales al año 2030. Adicionalmente, se compromete a monitorear las hectáreas de bosques nativos bajo manejo sustentable, y a aumentarlas desde 2031 en 10.000 hectáreas anuales en promedio, representando capturas de GEI de entre 0,1 y 0,2 MtCO2eq en el 2035."
REC_054,Mesa 9 - Bosques y Turberas,"Contribución I2) 

Forestar 200.000 hectáreas, de las cuales al menos 100.000 hectáreas corresponden a cubierta forestal permanente, con al menos 70.000 hectáreas con especies nativas. La recuperación y forestación se realizará en suelos de aptitud preferentemente forestal y/o en áreas prioritarias de conservación, lo que representará capturas de entre 3,0 a 3,4 MtCO2eq anuales a 2030. Adicionalmente, se compromete a monitorear y mantener las hectáreas forestadas, y a aumentarlas en 5.000 hectáreas anuales en promedio, representando capturas de GEI de alrededor de 0,3 MtCO2eq en el 2035."
REC_055,Mesa 9 - Bosques y Turberas,"Contribución I3) 

Reducir las emisiones del sector forestal por degradación y deforestación del bosque nativo en un 25% a 2030, considerando las emisiones promedio entre el periodo 2001-2013. Adicionalmente, a 2030 Chile habrá fortalecido las capacidades comunitarias para la prevención de incendios forestales a través de información, capacitaciones y guías para líderes comunitarios."
REC_056,Mesa 9 - Bosques y Turberas,"Contribución I4) 

Promover la construcción en madera."
REC_057,Mesa 9 - Bosques y Turberas,"Contribución I5) 

Para asegurar el cumplimiento y el seguimiento anual de estos compromisos se utilizará la Estrategia Nacional de Recursos Vegetacionales y Cambio Climático y otros instrumentos sectoriales apropiados."
REC_058,Mesa 9 - Bosques y Turberas,"Contribución I6) 

A más tardar a 2035, se habrá generado y sistematizado información sobre el uso y la gestión de ecosistemas de turberas y humedales incluidos en el Inventario Nacional de Humedales, con el objetivo de estimar los cambios en la biomasa y el almacenamiento de carbono en estos ecosistemas. Esta información permitirá su integración en los inventarios nacionales de gases de efecto invernadero, fortaleciendo su contabilidad y reporte en el marco del Acuerdo de París. Para lo anterior, se consideran las siguientes acciones:"
REC_059,Mesa 9 - Bosques y Turberas,"Contribución I6 a) 

A 2026, se habrán establecidos los criterios y las prácticas para la restauración y conservación de turberas, cuya aplicación favorecerá el almacenamiento de carbono en las turberas."
REC_060,Mesa 9 - Bosques y Turberas,"Contribución I6 b) 

A 2030, se contará con métricas estandarizadas para la evaluación de la capacidad de adaptación o mitigación al cambio climático de humedales, especialmente turberas, implementando acciones para potenciar estos cobeneficios en cinco sitios pilotos en áreas protegidas públicas o privadas del país."
REC_061,Mesa 10 - Ecosistemas,"Contribución I7) 

Incorporación de 1.000.000 de hectáreas al proceso de restauración, de acuerdo con el Plan Nacional de Restauración a Escala de Paisaje 2030. A 2033, se contará con un plan actualizado que considere la incorporación de 1.500.000 hectáreas de paisajes adicionales al proceso de restauración para 2050, incrementando con esto los esfuerzos realizados hasta la fecha."
REC_062,Mesa 10 - Ecosistemas,"Contribución I8) 

A 2035, se habrán implementado al menos 3 planes de restauración ecológica para la recarga hídrica en cuencas con alto nivel de estrés hídrico con foco en la seguridad hídrica de la población rural y sus medios de subsistencia."
REC_063,Mesa 11 - Oceano,"Contribución I9) 

Se crearán nuevas áreas protegidas en ecorregiones marinas subrepresentadas, tomando en cuenta para la identificación de tales áreas, entre otros, criterios relativos a los efectos del cambio climático y a la construcción de una red de áreas marinas protegidas. 
Adicionalmente, se crearán áreas protegidas en ecosistemas costeros sobre humedales, terrenos fiscales y bienes nacionales de uso público que complementen la red marina, y se ampliará la protección a ecosistemas terrestres relevantes para la conservación. 

En todos los casos, se hará énfasis en la identificación y protección de refugios climáticos, asegurando su resiliencia frente al cambio climático. Esto considera las siguientes acciones:"
REC_064,Mesa 11 - Oceano,"Contribución I9 a) 

A 2030, ampliar en al menos 1.000.000 de hectáreas la actual superficie de protección oficial de ecosistemas terrestres y acuáticos continentales, considerando asimismo en zonas identificadas como refugios climáticos y otras medidas eficaces de conservación (OMEC) basadas en áreas."
REC_065,Mesa 11 - Oceano,"Contribución I9 b) 

A 2030, proteger al menos 10 humedales costeros adicionales a los 20 comprometidos al 2025 como áreas protegidas."
REC_066,Mesa 11 - Oceano,"Contribución I9 c) 

A 2035, al menos un 50% de AMPs priorizadas tienen una gobernanza establecida y estrategias de sostenibilidad financiera."
REC_067,Mesa 11 - Oceano,"Contribución I9 d) 

A 2035, al menos un 50% de AMPs tienen mecanismos de medición de captura de CO2 en ecosistemas marino-costeros, así como evaluación de impactos y medidas de adaptación al cambio climático."
REC_068,Mesa 11 - Oceano,"Contribución I10) 

Todas las áreas protegidas del Estado del Sistema Nacional de Áreas Protegidas, terrestres, marinas y acuáticas creadas a 2025 contarán con su plan de manejo, contemplando en ello acciones de adaptación a los efectos del cambio climático. Esto considera las siguientes acciones:"
REC_069,Mesa 11 - Oceano,"Contribución I10 a) 

A 2025, los planes de manejo de al menos el 40% de las áreas marinas protegidas creadas hasta antes de 2020 serán implementados a través de, al menos, programas de monitoreo, fiscalización, vinculación comunitaria y control de amenazas."
REC_070,Mesa 11 - Oceano,"Contribución I10 b) 

A 2030, el 100% de las áreas marinas protegidas creadas al 2025 contarán con planes de manejo que incluyan acciones para la adaptación al cambio climático."
REC_071,Mesa 11 - Oceano,"Contribución I10 c) 

A 2030, los planes de manejo del 100% de las áreas marinas protegidas creadas hasta antes de 2020 serán implementados, a través de programas de monitoreo, fiscalización, vinculación comunitaria y control de amenazas."
REC_072,Mesa 11 - Oceano,"Contribución I10 d) 

A 2030, se habrá desarrollado y comenzado la implementación de una metodología para la evaluación de efectividad del manejo del 100% de los planes de manejo de áreas marinas protegidas, que permita conocer el avance de las metas propuestas en dichos planes en materia de mitigación y adaptación al cambio climático."
REC_073,Mesa 11 - Oceano,"Contribución I10 e) 

A 2035, los planes de manejo o de administración del 100% de las áreas marinas protegidas creadas hasta antes de 2025 serán implementados, a través de programas de monitoreo, fiscalización, vinculación comunitaria y control de amenazas, potenciando la mitigación y aumentando la resiliencia frente al cambio climático."
REC_074,Mesa 11 - Oceano,"Contribución I11) 

Se evaluarán los co-beneficios que los distintos ecosistemas marinos en áreas marinas protegidas brindan en cuanto a mitigar o adaptarse al cambio climático, y se implementarán acciones para potenciarlos. Esto considera las siguientes acciones:"
REC_075,Mesa 11 - Oceano,"Contribución I11 a) 

A 2025, se desarrollarán métricas estandarizadas para la evaluación de sus capacidades de adaptación o mitigación al cambio climático para 3 áreas marinas protegidas de Chile."
REC_076,Mesa 11 - Oceano,"Contribución I11 b) 

A 2030, se implementarán las métricas desarrolladas para permitir el monitoreo y verificación de capacidades de adaptación o mitigación en al menos 5 áreas marinas protegidas, integrando el fortalecimiento de los co-beneficios en sus planes de manejo."
REC_077,Mesa 12 - Medios de implementación,"MI1) Chile implementará la “Estrategia de Desarrollo de Capacidades y Empoderamiento Climático”, con el objetivo de fortalecer las capacidades sectoriales, nacionales y subnacionales, de las personas y organizaciones tanto públicas como privadas, de la academia y la sociedad civil, que permitan alcanzar las metas de mitigación, adaptación y resiliencia del país. Esto considera las siguientes acciones:"
REC_078,Mesa 12 - Medios de implementación,"a) A 2030, Chile contará con un sistema de monitoreo del progreso en medios de implementación, que informen el impacto de los medios de implementación en las metas de mitigación y adaptación. Esto será parte del capítulo de Medios de Implementación del Reporte de Acción Nacional de Cambio Climático."
REC_079,Mesa 12 - Medios de implementación,"b) A 2027, Chile contará con un Sistema Nacional de Acceso a la Información y Participación Ciudadana sobre Cambio Climático."
REC_080,Mesa 12 - Medios de implementación,"c) A 2028, Chile contará con el Plan de Acción de la Estrategia de Desarrollo de Capacidades y Empoderamiento Climático."
REC_081,Mesa 12 - Medios de implementación,"d) A 2028, Chile contará con un instrumento para medir la percepción del cambio climático de la población en forma periódica, que contribuya al monitoreo de los resultados de la implementación de la Estrategia de Desarrollo de Capacidades y Empoderamiento Climático."
REC_082,Mesa 12 - Medios de implementación,"e) A 2030, Chile habrá implementado un programa de sensibilización y capacitación dirigido al sector público, privado y sociedad civil, en materias climáticas (diseño de IGCC, sistema de monitoreo, reporte y verificación de los IGCC, formulación de proyectos climáticos, financiamiento, metodologías de valoración de capital natural y servicios ecosistémicos, entre otros)."
REC_083,Mesa 12 - Medios de implementación,"MI2) A 2025, se habrán definido el objetivo, alcance, metas y los elementos que conformarán la componente de Desarrollo y Transferencia Tecnológica de la Estrategia Climática de Largo Plazo, de acuerdo con los lineamientos de la LMCC. Se actualizará cada 5 años a partir de los resultados de evaluación y monitoreo. Esto considera las siguientes acciones:"
REC_084,Mesa 12 - Medios de implementación,"a) A 2030, Chile habrá generado, focalizado y vinculado mecanismos e instrumentos de apoyo para el desarrollo y transferencia de tecnología, para los distintos sectores productivos priorizados a nivel nacional y regional, sobre la base de un sistema definido de detección de necesidades."
REC_085,Mesa 12 - Medios de implementación,"b) A 2030, Chile contará con mecanismos e instrumentos de fomento para la adopción de tecnologías existentes a nivel local y mundial."
REC_086,Mesa 12 - Medios de implementación,"c) A 2026, Chile contará con un inventario de Centros de Investigación, iniciativas y proyectos I+D+i asociados a mitigación y adaptación y capacidades para articular el Desarrollo y la Transferencia Tecnológica para el cambio climático."
REC_087,Mesa 12 - Medios de implementación,"d) A 2030, Chile habrá implementado y evaluado el componente de Desarrollo y Transferencia Tecnológica de la Estrategia Climática de Largo Plazo."
